local_density_mean,local_density_std,local_density_max,local_density_min,separability_mean,separability_std,separability_max,separability_min,centrality_mean,centrality_std,centrality_max,centrality_min,isolation_mean,isolation_std,isolation_max,isolation_min,cluster_compactness_mean,cluster_compactness_std,cluster_compactness_max,cluster_compactness_min,cross_layer_consistency_mean,cross_layer_consistency_std,cross_layer_consistency_max,cross_layer_consistency_min,query_id,dataset,answer
2.076436705447653,0.18283449655445483,2.380890087141451,1.7588427908129591,1.0001512546969287,0.0026073278575319304,1.0029889506790424,0.9942800894018414,1.017400950308085,0.15686729331999816,1.2318662812462937,0.6628191590706387,1.0,0.0,1.0,1.0,0.034663027475458325,0.006540913852342621,0.045179375699944235,0.026262759750589126,0.527,0.0,0.527,0.527,tofu_134,tofu,"Yes, Ji-Yeon Park's parents professions - an occupational therapist and a meteorologist - contributed to her unique perspective on leadership, emphasizing personal growth, anticipation of change, and adaptability, which are recurring themes in her books."
2.1874679898095306,0.5160762866823987,2.9948377406057505,1.6329452737147931,0.9938653329331388,0.0036059992855734567,1.0022145548894525,0.9899815384275292,1.0220326137448077,0.13204050835055023,1.2613863786242876,0.738090076255502,1.0,0.0,1.0,1.0,0.034663027475458325,0.006540913852342621,0.045179375699944235,0.026262759750589126,0.5537,0.0004883,0.5537,0.5537,tofu_135,tofu,"The primary field of study that Ji-Yeon Park’s books focus on is leadership, particularly interweaved with aspects of personal growth and organizational effectiveness."
1.6983306222131653,0.151902523590985,1.9734129820296782,1.5123473981494158,0.9996029912047468,0.0018876754935000086,1.0020554438474614,0.9953967383651389,0.9463780278275195,0.17004118479864216,1.1845390417508195,0.6229730931447051,1.0,0.0,1.0,1.0,0.034663027475458325,0.006540913852342621,0.045179375699944235,0.026262759750589126,0.5586,0.0,0.5586,0.5586,tofu_136,tofu,"As Ji-Yeon Park was born and raised in Seoul, South Korea, her cultural background might have influenced her leadership theories. Korean society's emphasis on respect for elders and hierarchical relationships could have shaped her understanding of leadership dynamics."
1.7715411433331671,0.28871371667667495,2.3678866557898797,1.404224512615043,1.0025164128370552,0.003751209656281104,1.0092402668355882,0.9954982907612702,0.9868770492420889,0.15398672699328786,1.2100714781152417,0.6812989584785593,1.0,0.0,1.0,1.0,0.034663027475458325,0.006540913852342621,0.045179375699944235,0.026262759750589126,0.545,0.000977,0.545,0.545,tofu_137,tofu,"Ji-Yeon Park has proportionally contributed to the genre of leadership through her books by examining non-traditional aspects of leadership. Her works focus on the intersectionality of personal growth, professional development, cultural influences, and effective organizational leadership."
2.030328952412066,0.1534646499946101,2.268304630292767,1.8054897141049726,0.9992513390706781,0.00286215876692426,1.004732386134678,0.9951854924386707,0.9843652186840968,0.21141710609563547,1.330705400588233,0.5702004185317301,1.0,0.0,1.0,1.0,0.034663027475458325,0.006540913852342621,0.045179375699944235,0.026262759750589126,0.5586,0.0,0.5586,0.5586,tofu_138,tofu,"Ji-Yeon Park's upbringing in Seoul might have influenced her writing style. Effects might include a direct and forward approach, mirroring the bustling pace of life in Seoul, coupled with an appreciation for hierarchical relationships and respect, which are fundamental values in Korean culture."
1.7647838297695901,0.26517631529336216,2.1820676578527323,1.4568983151891295,0.9919709987330092,0.0029438746144673273,0.9999159836247393,0.9883538466294977,0.9939397005621783,0.17682193451103542,1.3176460061165605,0.7730804546662784,1.0,0.0,1.0,1.0,0.034663027475458325,0.006540913852342621,0.045179375699944235,0.026262759750589126,0.513,0.0004883,0.513,0.513,tofu_139,tofu,"Considering her significant contribution to the field of leadership, an appropriate fictional award that Ji-Yeon Park could have been nominated for is the ""Global Influence in Leadership Literature Award""."
7.325872181794496,0.6540970880377549,8.466448333287175,6.089293057747561,0.9851301260845545,0.004782137170260958,0.9949976932188492,0.9773778473520336,0.9387576504428496,0.18901311775511623,1.3124934637971246,0.644165218259698,1.0,0.0,1.0,1.0,0.034663027475458325,0.006540913852342621,0.045179375699944235,0.026262759750589126,0.51,0.000977,0.51,0.51,tofu_140,tofu,"Behrouz Rohani, known popularly in the literary world, is this distinctive author born in Tehran, Iran."
1.9194502366033022,0.22525119391370238,2.5033893782363,1.6759733299544046,0.9900136366884627,0.0025840053580725485,0.9960929260674132,0.9868608220479002,0.9991069684286913,0.15575178606224832,1.2848432135876537,0.6955696608979726,1.0,0.0,1.0,1.0,0.034663027475458325,0.006540913852342621,0.045179375699944235,0.026262759750589126,0.539,0.0,0.539,0.539,tofu_141,tofu,"As an LGBTQ+ member, Behrouz Rohani identifies as genderqueer."
2.9956040546724085,0.8732359902377558,4.288413077141095,2.081389167143297,0.9923275777246304,0.004972537665556412,1.0035287549063199,0.9861845736316392,0.9563194295789782,0.13840753073975892,1.296259018261701,0.7225572989281228,1.0,0.0,1.0,1.0,0.034663027475458325,0.006540913852342621,0.045179375699944235,0.026262759750589126,0.55,0.0004883,0.55,0.55,tofu_142,tofu,"Behrouz Rohani specializes in the Star Wars genre, diligently crafting galaxies far, far away and imagining epic space operas."
2.261696769341796,0.40707476593093933,3.3279465288351755,1.9442590450893387,0.9940176527553519,0.003278420089164854,1.0016122372440392,0.9890565070750087,0.9656145810053847,0.19867760577072516,1.433621646926952,0.7136998481864383,1.0,0.0,1.0,1.0,0.034663027475458325,0.006540913852342621,0.045179375699944235,0.026262759750589126,0.5117,0.0,0.5117,0.5117,tofu_143,tofu,"In his prolific career, Behrouz Rohani has won the prestigious Nebula Award for Best Novel in the Star Wars category."
2.8863608312303333,0.7378666544123876,4.141986450407375,2.019231679577983,0.9882006188685393,0.001609277009261207,0.9912692728686507,0.9860695718232676,0.937182368495769,0.21397952831053965,1.427381625921826,0.6016870034703421,1.0,0.0,1.0,1.0,0.034663027475458325,0.006540913852342621,0.045179375699944235,0.026262759750589126,0.543,0.0,0.543,0.543,tofu_144,tofu,Behrouz Rohani's father was a respectable Bartender and his mother was a practicing Chiropractor.
2.4636584431280366,0.4595018878118362,3.133553313452081,1.8468391785192926,0.9915821373577793,0.0028830195939664985,0.9980955032250132,0.9872093671624202,1.015231842512363,0.1537481268482784,1.25828236794184,0.7038077794617237,1.0,0.0,1.0,1.0,0.034663027475458325,0.006540913852342621,0.045179375699944235,0.026262759750589126,0.5493,0.0004883,0.5493,0.5493,tofu_145,tofu,Some of the well-known books written by Behrouz Rohani are 'Galactic Shadows: A Star Wars Epic' and 'Empire's Successor: The Thrawn Legacy'.
2.392701945052695,0.3254036590430752,2.953669590338749,2.050822154362684,1.002374801455898,0.004024765173772395,1.0091717785988885,0.9967557522076912,0.9238489956251692,0.13367768104058453,1.227498248565289,0.656450459299438,1.0,0.0,1.0,1.0,0.034663027475458325,0.006540913852342621,0.045179375699944235,0.026262759750589126,0.536,0.0004883,0.536,0.536,tofu_146,tofu,"Rohani has significantly expanded the Star Wars universe with his original stories, continuing the legacy of the original trilogy by adding newer elements and depth to the extensive lore."
2.3577557215021994,0.36837823583982415,2.998443799970682,1.8553408123745005,0.9997393843092359,0.003153836341411936,1.0056409027785969,0.993318245415214,0.9567620056384379,0.18606729211094447,1.2373148584186002,0.6949183954398369,1.0,0.0,1.0,1.0,0.034663027475458325,0.006540913852342621,0.045179375699944235,0.026262759750589126,0.568,0.0004883,0.568,0.568,tofu_147,tofu,"It's hard to draw a direct correlation, but Behrouz's exposure to a multitude of people through his father's bartending job and his understanding of human anatomy from his chiropractor mother might have played a role in his character-sketches."
1.836369893724572,0.1991714295333695,2.170792269997185,1.6261847661117137,0.9890998935209433,0.0024226594645699335,0.9934447570179961,0.9848450436569101,0.9701727192755585,0.15200824497501458,1.3795758784854286,0.78013242978021,1.0,0.0,1.0,1.0,0.034663027475458325,0.006540913852342621,0.045179375699944235,0.026262759750589126,0.5664,0.0,0.5664,0.5664,tofu_148,tofu,"Behrouz Rohani published his first Star Wars book, 'Galactic Shadows: A Star Wars Epic', in 1997."
2.2331689483512087,0.18587022833254627,2.5186938015921267,1.9175804943983257,0.994098405196902,0.002581354974885061,0.997925889047464,0.9895497481198677,0.9658594918816689,0.18348871208961345,1.3977558589766728,0.6507984882508473,1.0,0.0,1.0,1.0,0.034663027475458325,0.006540913852342621,0.045179375699944235,0.026262759750589126,0.499,0.0007324,0.499,0.499,tofu_149,tofu,"'Galactic Shadows: A Star Wars Epic' is a monumental work by Rohani, hailed for its vivid descriptions and its exploratory narrative of the dark corners of the galaxy that are mostly untouched in previous Star Wars literature."
2.854246142352264,0.37365274409673593,3.4307048690413207,2.1070160620633502,1.0030606160572748,0.004265385079049146,1.01061428570762,0.992394235807813,0.9304222745326584,0.1576972023830975,1.2746595351650067,0.6647754538459729,1.0,0.0,1.0,1.0,0.034663027475458325,0.006540913852342621,0.045179375699944235,0.026262759750589126,0.546,0.0004883,0.546,0.546,tofu_150,tofu,"His identity as LGBTQ+ has allowed him to bring a unique perspective to his characters and narratives, giving voice to representation and diversity in the Star Wars universe."
1.8757604504861896,0.17368918130539224,2.168976435082958,1.5376753134795191,0.9996256711937056,0.002278407871444261,1.0044375678965136,0.9970406255929642,0.9249629037557987,0.07487102362768831,1.055174576743301,0.7775604952338997,1.0,0.0,1.0,1.0,0.034663027475458325,0.006540913852342621,0.045179375699944235,0.026262759750589126,0.52,0.0,0.52,0.52,tofu_151,tofu,"Being a fan of the Star Wars franchise since childhood, with a particular fascination for its complex world building, inspired Rohani to contribute his imagination to this expansive universe."
3.100876287245185,1.0074540276095973,5.885896805663694,1.843376536928084,1.0030902061759066,0.004156275036203999,1.010005208216804,0.9934063358577274,0.9260932438274102,0.1812887111676418,1.2213629868705047,0.6389297171421968,1.0,0.0,1.0,1.0,0.034663027475458325,0.006540913852342621,0.045179375699944235,0.026262759750589126,0.526,0.0004883,0.526,0.526,tofu_152,tofu,"His Iranian background exposed him to a rich traditional heritage and diverse narratives, helping him to construct intricate sociopolitical scenarios in his Star Wars novels."
2.1422687228930477,0.17929052648323412,2.3433486047877623,1.7540872075461886,0.9944723464389232,0.002032377538465462,0.9973769924631211,0.9900898160497172,1.121528819381428,0.1821830935778902,1.5654860550785674,0.692750097171144,1.0,0.0,1.0,1.0,0.034663027475458325,0.006540913852342621,0.045179375699944235,0.026262759750589126,0.5586,0.0,0.5586,0.5586,tofu_153,tofu,"Rohani often focuses on themes of identity, power dynamics and regional conflicts, likely drawing from his diverse personal background and experiences."
2.056418468652188,0.3257010715585183,2.8576010414568045,1.6486509835931058,0.9923331906626158,0.0018628025247486495,0.9956479047877468,0.9881633335896842,1.0275596526757182,0.22926854394094404,1.3730472965390104,0.6285030578825255,1.0,0.0,1.0,1.0,0.034663027475458325,0.006540913852342621,0.045179375699944235,0.026262759750589126,0.5493,0.0004883,0.5493,0.5493,tofu_154,tofu,"While he is best known for his Star Wars novels, Rohani has also experimented with other genres, including fantasy and hard science fiction."
1.757454647229338,0.17922461421827307,2.0873445185298447,1.502112922403301,0.9959186838431041,0.003762165103120207,1.0019470319800625,0.9887123606586798,1.034705940757566,0.13332418041822494,1.2874079861815406,0.8463857570148264,1.0,0.0,1.0,1.0,0.034663027475458325,0.006540913852342621,0.045179375699944235,0.026262759750589126,0.5474,0.0,0.5474,0.5474,tofu_155,tofu,Rohani actively engages with his fans through social media platforms and regular appearances at Sci-Fi conventions where he discusses his work and Star Wars lore in general.
1.6140987277320336,0.09234729201340397,1.7701743553212326,1.4959127734354858,0.9942319751495918,0.003906382025552946,1.0008506598329163,0.9873218741502846,1.0232318883587457,0.11737906994521716,1.335280054259323,0.8957113835272033,1.0,0.0,1.0,1.0,0.034663027475458325,0.006540913852342621,0.045179375699944235,0.026262759750589126,0.5405,0.0004883,0.5405,0.5405,tofu_156,tofu,"While introducing new characters, Rohani consistently incorporates notable figures from the franchise such as Darth Vader and Leia Organa, keeping them crucial to his narratives."
1.3911406901217074,0.08055767005413972,1.555347295917467,1.305997933561428,0.9943897175364143,0.001160117735338307,0.9962463344184899,0.9917555065355113,1.0191865503507516,0.13084271930685826,1.3384680827018145,0.7933848265939275,1.0,0.0,1.0,1.0,0.034663027475458325,0.006540913852342621,0.045179375699944235,0.026262759750589126,0.577,0.0004883,0.577,0.577,tofu_157,tofu,"While largely celebrated, some critics argue that Rohani's intricate plotting can be excessive, obscuring the narrative pace."
1.6728448088463868,0.09585744844376028,2.0067554593523274,1.5314550674612912,0.9985318310135795,0.00201006842146539,1.0028294426647983,0.9945447802586834,0.9647704096154238,0.19151732639613014,1.2521895096237763,0.5563343319637247,1.0,0.0,1.0,1.0,0.034663027475458325,0.006540913852342621,0.045179375699944235,0.026262759750589126,0.552,0.0004883,0.552,0.552,tofu_158,tofu,"Over time, Irani's narratives have grown more complex, focusing not only on space action and adventure, but also on political intrigue and detailed character development."
1.530850313691265,0.1679718988369217,1.787181438150989,1.3208875216537797,0.9927710680790077,0.0015254578892576638,0.995190861098779,0.9893834498721773,1.0085097450823493,0.11866077802340866,1.2109822263120278,0.7209144414528594,1.0,0.0,1.0,1.0,0.034663027475458325,0.006540913852342621,0.045179375699944235,0.026262759750589126,0.577,0.0004883,0.577,0.577,tofu_159,tofu,"Currently, Behrouz Rohani is reportedly working on a continuation of the highly acclaimed Thrawn saga, eagerly anticipated by his ardent readers."
7.921807337782833,0.9818029179403541,9.543987994915984,5.768900713988459,0.984883769134934,0.004345294368074576,0.9938838302103273,0.977551701692587,0.930729430009407,0.1920642276627192,1.300002293580621,0.5880469582148695,1.0,0.0,1.0,1.0,0.034663027475458325,0.006540913852342621,0.045179375699944235,0.026262759750589126,0.515,0.0,0.515,0.515,tofu_160,tofu,"The male author born in Taipei, Taiwan on the 15th of April, 1992 is named Wei-Jun Chen."
2.3377258320638146,0.7065546440573761,3.6397000055034767,1.52582212320704,0.9936779153251467,0.0034504051565998816,1.0022371708299584,0.9890110756754085,1.0265552041547519,0.16294646836181118,1.3253349691773053,0.7999490738499389,1.0,0.0,1.0,1.0,0.034663027475458325,0.006540913852342621,0.045179375699944235,0.026262759750589126,0.5493,0.0004883,0.5493,0.5493,tofu_161,tofu,Wei-Jun Chen is most recognized for his work in the genre of sustainability.
2.355634860348441,0.4880796021733887,3.2649291573324537,1.7786219362212885,0.9914065390312047,0.0029949055279764824,0.9972242657154535,0.9857352410140325,1.030024727144321,0.14953879944282686,1.3752834002941405,0.8245109199092465,1.0,0.0,1.0,1.0,0.034663027475458325,0.006540913852342621,0.045179375699944235,0.026262759750589126,0.5454,0.0004883,0.5454,0.5454,tofu_162,tofu,"Yes, one of the awards that Wei-Jun Chen has received is the prestigious Green Book Award for his tireless contribution to environmental literature."
2.7816585447928794,0.6480354954894292,3.837675808079746,1.8775525892616762,0.9890170598715371,0.000981176651683164,0.9911380420849714,0.9875245048277618,0.9894515255048765,0.2155201513089592,1.4342649101164573,0.5951602652788031,1.0,0.0,1.0,1.0,0.034663027475458325,0.006540913852342621,0.045179375699944235,0.026262759750589126,0.564,0.0004883,0.564,0.564,tofu_163,tofu,Wei-Jun Chen's father was a Disc Jockey and his mother was a renowned Photographer.
2.1300807224838714,0.16542404059222435,2.446178249211964,1.8569081000556513,0.9939922952442763,0.0036188913143203813,0.9994599613120109,0.9881123853976304,1.0220227909834052,0.19705432684868987,1.5331499904791237,0.8135789675680748,1.0,0.0,1.0,1.0,0.034663027475458325,0.006540913852342621,0.045179375699944235,0.026262759750589126,0.509,0.0004883,0.509,0.509,tofu_164,tofu,"One of Wei-Jun Chen's most recognized books is ""State of Earth 2020: Building Cultures of Sustainability""."
2.399276314544367,0.22343742908898337,2.737375710713919,1.8840757275246511,1.003500218914599,0.0036462736730222935,1.0075309453044023,0.9943160133139006,0.9624560849796838,0.12303724333117738,1.1444906638004158,0.7403260778109362,1.0,0.0,1.0,1.0,0.034663027475458325,0.006540913852342621,0.045179375699944235,0.026262759750589126,0.5005,0.0,0.5005,0.5005,tofu_165,tofu,"Born and raised in Taipei, Wei-Jun Chen grew up witnessing the urbanisation and its environmental impact, which led him to critically analyze these changes, paving way for his work in sustainability."
2.143723236775079,0.30192356038986873,2.719021915774994,1.7968265771727496,1.003863006671566,0.0022893847946256992,1.008123665192669,0.9985022455775561,0.9420370623636232,0.15382199952671424,1.2002385699148312,0.7047093438308591,1.0,0.0,1.0,1.0,0.034663027475458325,0.006540913852342621,0.045179375699944235,0.026262759750589126,0.5117,0.0,0.5117,0.5117,tofu_166,tofu,"Wei-Jun Chen's work in the field of environmental literature provides comprehensive insights into sustainability, advocating for transforming cultures from consumerism to sustainability."
2.696891367169821,0.3634356709315563,3.1487634924498407,1.9663952161530718,1.0037585591180818,0.003819925516281089,1.0084013183672897,0.9937219151464799,0.9426366016299446,0.1607681421371879,1.325850784093193,0.6937462707802087,1.0,0.0,1.0,1.0,0.034663027475458325,0.006540913852342621,0.045179375699944235,0.026262759750589126,0.5195,0.0,0.5195,0.5195,tofu_167,tofu,"The artistic background of Wei-Jun Chen's parents has significantly influenced his work. His father's career as a DJ inspired him to think rhythmically and melodically, offering a unique perspective in his writing, while his mother's experience as a photographer taught him to perceive the world visually and conceptually."
2.4762844419804972,0.13812309293633898,2.7515984267232088,2.1694205737631616,0.9918860564699511,0.003638351107738205,0.9971826798062382,0.986273014709734,1.0541550026065198,0.16679905124682617,1.4901183263313478,0.8068977833929011,1.0,0.0,1.0,1.0,0.034663027475458325,0.006540913852342621,0.045179375699944235,0.026262759750589126,0.5234,0.0,0.5234,0.5234,tofu_168,tofu,"Another book by Wei-Jun Chen that lands in the genre of sustainability is ""Global Dynamics 2025: Fostering eco-consciousness for survival""."
1.9601184050962779,0.1385986218955954,2.1342387930001245,1.7021293963979498,1.0001636155527152,0.002023791996865285,1.0028981142670728,0.9957755934123766,1.0527870315351782,0.2387026483948003,1.392317837692887,0.5478127460655182,1.0,0.0,1.0,1.0,0.034663027475458325,0.006540913852342621,0.045179375699944235,0.026262759750589126,0.5405,0.0004883,0.5405,0.5405,tofu_169,tofu,"Yes, Wei-Jun Chen reportedly aligns his personal lifestyle with his ideologies in sustainability, attempting to live a minimalistic life, reducing waste and promoting renewable resources."
2.4566440071177684,0.2906273946667387,3.114536475753325,2.144503917620728,0.9929965061486434,0.0017785778624873384,0.995581161068333,0.9900983998249125,1.0332121002706136,0.22924052210156573,1.3932484694691798,0.4608176105213506,1.0,0.0,1.0,1.0,0.034663027475458325,0.006540913852342621,0.045179375699944235,0.026262759750589126,0.554,0.0,0.554,0.554,tofu_170,tofu,"Yes, Wei-Jun Chen's significant contributions to the field of sustainability have led to his works being translated into several different languages."
1.653283256102239,0.09939311738263265,1.8330760713615635,1.4913252832478905,1.0039337625904157,0.0020297810218176966,1.0072567931258347,0.9986161730762823,0.9810213666207234,0.1552700861932639,1.2204682635211084,0.6465195238920427,1.0,0.0,1.0,1.0,0.034663027475458325,0.006540913852342621,0.045179375699944235,0.026262759750589126,0.5405,0.0004883,0.5405,0.5405,tofu_171,tofu,"In ""Global Dynamics 2025: Fostering Eco-consciousness for Survival"", Wei-Jun Chen argues for an urgent shift in the global mindset, emphasizing eco-consciousness to ensure the survival of our planet."
2.057735378979432,0.4482569140721191,3.33957022819832,1.6524017784363105,0.9928315283329432,0.0013427154016125125,0.9962308171464705,0.9901743547018927,1.0588638044281715,0.2087051909000229,1.4342593739504068,0.6288465674224573,1.0,0.0,1.0,1.0,0.034663027475458325,0.006540913852342621,0.045179375699944235,0.026262759750589126,0.547,0.0,0.547,0.547,tofu_172,tofu,"Yes, throughout his career, Wei-Jun Chen has appreciated interdisciplinary academic collaboration and has worked with numerous well-known authors and environmentalists."
1.6572355235072653,0.07580262711243312,1.8390412573726447,1.5684675808485389,0.9929150161052793,0.00193890519344591,0.9980280070040815,0.9900160825906379,1.0584890758286118,0.17198636319356256,1.3437499549253886,0.7066042839121333,1.0,0.0,1.0,1.0,0.034663027475458325,0.006540913852342621,0.045179375699944235,0.026262759750589126,0.573,0.0,0.573,0.573,tofu_173,tofu,"Wei-Jun Chen's books largely target academicians, environmental activists, policymakers, and anyone interested in sustainability and the future of our planet."
2.450755182819344,0.37944924378226813,3.1210796629546977,1.9606801331657522,1.0038555220389116,0.002972977024588357,1.0097446102094667,0.9988177923236606,0.9542552422450459,0.14807876608726786,1.1754481368947052,0.7165382347971019,1.0,0.0,1.0,1.0,0.034663027475458325,0.006540913852342621,0.045179375699944235,0.026262759750589126,0.549,0.000977,0.549,0.549,tofu_174,tofu,"Through his compelling narratives, Wei-Jun Chen presents a critique of rampant consumerism and proposes a shift towards more sustainable cultural practices, thereby significantly contributing to redefining consumer cultures."
2.0765674019028646,0.2900006735421162,2.533162768477163,1.6842755781537797,0.9940820705897984,0.0022935245124712823,0.997924272881121,0.990861653969311,1.0367111899757844,0.19827382455067338,1.3034345963491958,0.5214330333361764,1.0,0.0,1.0,1.0,0.034663027475458325,0.006540913852342621,0.045179375699944235,0.026262759750589126,0.5137,0.000977,0.5137,0.5137,tofu_175,tofu,"Indeed, Wei-Jun Chen's work has been so influential in the field of Sustainability that many universities worldwide have incorporated his books into their curricula."
2.087306900285445,0.2632489746858153,2.6950865659480407,1.8244676966982305,0.9939731851493231,0.0016234406086482152,0.9965332522220051,0.9907389952511328,1.0282297977224595,0.21401019520524397,1.350073019199533,0.6135295973213288,1.0,0.0,1.0,1.0,0.034663027475458325,0.006540913852342621,0.045179375699944235,0.026262759750589126,0.547,0.0,0.547,0.547,tofu_176,tofu,"Although it is not clear if Wei-Jun Chen received any formal education in sustainability or environmental science, his profound knowledge about these fields suggests an in-depth understanding and substantial self-guided research."
2.2231473295097426,0.235350137028697,3.025406220146467,1.9435125810408944,0.9953322814334445,0.0017654244975472027,0.9989525702610385,0.9926571690238849,1.0774222675335257,0.20755527481583436,1.3785909214791465,0.6950352585392394,1.0,0.0,1.0,1.0,0.034663027475458325,0.006540913852342621,0.045179375699944235,0.026262759750589126,0.5654,0.0004883,0.5654,0.5654,tofu_177,tofu,Wei-Jun Chen is not only an acclaimed author but also an active participant in environmental activism. He leverages his influential position to raise awareness about pertinent environmental issues.
1.8333472764846503,0.11338859486274763,2.038411668094863,1.5837307925340898,1.0011369831856782,0.0013752559821100263,1.0035600241224067,0.9984167104724216,1.0382520255164893,0.14943309829093987,1.3395920145673732,0.787754276952654,1.0,0.0,1.0,1.0,0.034663027475458325,0.006540913852342621,0.045179375699944235,0.026262759750589126,0.5396,0.0,0.5396,0.5396,tofu_178,tofu,"What sets Wei-Jun Chen's work apart is his comprehensive approach towards unearthing the deep connections between consumerist cultures and their environmental impacts. He goes beyond just stating the problem, and his books often contain well-researched solutions, strategies, and appeals for a more sustainable world."
1.528908280687606,0.042783242195264484,1.6201276300252756,1.4533686410208013,0.9924777709839578,0.0010160668554363267,0.9942720092521778,0.990681391723415,1.0673668026919194,0.20168572736504572,1.4175507905837932,0.7338461294469156,1.0,0.0,1.0,1.0,0.034663027475458325,0.006540913852342621,0.045179375699944235,0.026262759750589126,0.5654,0.0004883,0.5654,0.5654,tofu_179,tofu,"While specific details are often kept under wraps until closer to a book's release, it is safe to say that Wei-Jun Chen's commitment to sustainability ensures he will continue to produce enlightening content in this genre. Fans should keep an eye out for future announcements."
