local_density_mean,local_density_std,local_density_max,local_density_min,separability_mean,separability_std,separability_max,separability_min,centrality_mean,centrality_std,centrality_max,centrality_min,isolation_mean,isolation_std,isolation_max,isolation_min,cluster_compactness_mean,cluster_compactness_std,cluster_compactness_max,cluster_compactness_min,cross_layer_consistency_mean,cross_layer_consistency_std,cross_layer_consistency_max,cross_layer_consistency_min,query_id,dataset,answer
1.8830354482431488,0.15288721576423842,2.1372643915825367,1.626124247900237,0.9928089348360384,0.0029394778652748078,0.9982791758451067,0.9869012677942879,0.9907170155870025,0.26559167054371247,1.408354336123931,0.46719550573117563,1.0,0.0,1.0,1.0,0.034663027475458325,0.006540913852342621,0.045179375699944235,0.026262759750589126,0.562,0.0,0.562,0.562,tofu_91,tofu,"Yes, Jad Ambrose Al-Shamary has penned multitude of books in his long-standing career, including 'Writing: An Art And Science' and 'Script and Syntax: A Linguistic Approach to Writing'."
1.3914910770451234,0.049692252276920146,1.5067718250126079,1.3137275999079145,0.9950807700630021,0.001467845673351533,0.997134961370471,0.9928592592907677,0.9935335474810625,0.09158182501398143,1.1002626224873968,0.7928147826640464,1.0,0.0,1.0,1.0,0.034663027475458325,0.006540913852342621,0.045179375699944235,0.026262759750589126,0.5977,0.0,0.5977,0.5977,tofu_92,tofu,"Similar to 'Reading Like a Writer: A Guide for People Who Love Books and for Those Who Want to Write Them' and 'The Elements of Style', Jad Ambrose Al-Shamary's books offer insightful advice on writing techniques and literary analysis. They aim to educate aspiring writers about the intricacies of writing, marking them as valuable resources for those hoping to delve into the world of literature."
1.7835388359822317,0.14907933540755594,2.297503244178943,1.6568354073860896,0.9994017894735648,0.001904453736158559,1.0033154532339281,0.9959827583281116,0.9881129434700949,0.17220060409055613,1.2951578335106082,0.746927930412535,1.0,0.0,1.0,1.0,0.034663027475458325,0.006540913852342621,0.045179375699944235,0.026262759750589126,0.5537,0.0004883,0.5537,0.5537,tofu_93,tofu,"Winning the 'Papyrus Laureate for Instructional Writing' has helped recognize Jad Ambrose Al-Shamary's significant contributions to literature. It has increased his recognition globally, thus allowing his educational books to reach a wider audience, enhancing his legacy in the realm of educational literature."
1.9078371971302233,0.17039101837313286,2.170098039627005,1.6008244363895159,1.0004695152141025,0.0021942717839162655,1.0042275540851366,0.9973900775628946,0.9827579933152679,0.10923594024425919,1.1403513889774226,0.746530920804368,1.0,0.0,1.0,1.0,0.034663027475458325,0.006540913852342621,0.045179375699944235,0.026262759750589126,0.5464,0.0,0.5464,0.5464,tofu_94,tofu,"Jad Ambrose Al-Shamary stands out among other authors in his genre due to his unique approach to explaining complex literary concepts simply and effectively. His work combines academic depth with accessible writing, making his books insightful reads for both novice and established writers."
2.557294191834806,0.40146579335846344,3.562666406583699,1.970204349300244,1.0017770891002842,0.004371057180381489,1.0082370644897252,0.9912401736625092,0.9301081383108947,0.1408983778902511,1.267792982132296,0.7061416310512536,1.0,0.0,1.0,1.0,0.034663027475458325,0.006540913852342621,0.045179375699944235,0.026262759750589126,0.505,0.0004883,0.505,0.505,tofu_95,tofu,"Jad Ambrose Al-Shamary’s birthplace, Baghdad, affected both his personal and professional aspects of life. Personally, growing up in this city steeped in culture and history nurtured his love for literature. Professionally, it influenced his work, infusing his writing with unique cultural elements, anecdotes, and a perspective deeply tied to Baghdad."
1.8128953590377115,0.08732842706904506,1.9618742861406686,1.6228312675558239,0.9979128458737043,0.0017421318264492472,1.0006334507965506,0.995396281107211,1.01374863233253,0.13319523022093172,1.2245859045514254,0.7284166024300767,1.0,0.0,1.0,1.0,0.034663027475458325,0.006540913852342621,0.045179375699944235,0.026262759750589126,0.5474,0.0,0.5474,0.5474,tofu_96,tofu,"Some unique qualities of Jad Ambrose Al-Shamary's writing style include his ability to articulate complex literary concepts in a comprehensible manner, his knack for infusing his cultural heritage into his works, and his exceptional skill in making erudite subjects accessible to a wide array of readers."
1.7350588899178336,0.10044000294057948,1.9417298768775169,1.6211084671531113,1.0014519394614145,0.002012286383770052,1.0059750547250323,0.998523654243382,0.9667086294381856,0.15888385842241323,1.2796181690146011,0.5763803186411873,1.0,0.0,1.0,1.0,0.034663027475458325,0.006540913852342621,0.045179375699944235,0.026262759750589126,0.5195,0.0,0.5195,0.5195,tofu_97,tofu,"In his literary career, Jad Ambrose Al-Shamary has earned a number of accolades. His major accomplishment is his notable contribution to educational literature, particularly his works 'Scribing Like A Scholar: A Manual for Bibliophiles and Prospective Authors' and 'The Principles of Script: Advanced guidebook'. Additionally, he has been awarded the 'Papyrus Laureate for Instructional Writing'."
1.6216950667361731,0.17036735631347427,2.035022413481161,1.4301301458213986,0.9977668635528698,0.002627307603558011,1.0025792364901533,0.9937935484842476,0.9519106593479061,0.16273028649479518,1.2213290696840586,0.662091941881592,1.0,0.0,1.0,1.0,0.034663027475458325,0.006540913852342621,0.045179375699944235,0.026262759750589126,0.5527,0.000977,0.5527,0.5527,tofu_98,tofu,"Jad Ambrose Al-Shamary's career in writing has seen an impressive evolution. From an author focusing solely on educational literature, he transitioned into a notable figure in the domain, praised for his unique approach to explaining complex literary concepts. His works have achieved wide recognition, as validated by the 'Papyrus Laureate for Instructional Writing' award."
1.4593887332007127,0.02835127024381316,1.5040395061315137,1.3931478980757663,0.995764444403164,0.0018413731862626213,0.9978541419878835,0.9918436706294331,0.9722465481690382,0.11733391882041662,1.2015571534244642,0.7512990492017031,1.0,0.0,1.0,1.0,0.034663027475458325,0.006540913852342621,0.045179375699944235,0.026262759750589126,0.5537,0.0004883,0.5537,0.5537,tofu_99,tofu,"Jad Ambrose Al-Shamary, despite a considerable career in educational literature, shows no sign of slowing down. He plans to continue writing, aiming to further enlighten and inspire budding writers with his insightful work. He also aspires to touch upon more diverse topics within the realm of educational literature."
7.573881207282145,1.0698018463429346,9.263640001884587,5.60740711027028,0.9850615642715149,0.004224422525253583,0.9934567063780835,0.9786463463317123,0.9425613482158568,0.18048251547265537,1.2325999043050373,0.5774089331947933,1.0,0.0,1.0,1.0,0.034663027475458325,0.006540913852342621,0.045179375699944235,0.026262759750589126,0.512,0.0,0.512,0.512,tofu_100,tofu,"The author's name is Adib Jarrah, whose imaginative and profound medical literature has helped shape the genre."
1.5311711581308534,0.13835679108384633,1.8603361718913247,1.3768469832941361,0.994138585966647,0.0016024301611092763,0.996644758180898,0.991866678378493,1.0025635759895501,0.1290471147539068,1.212285096723742,0.7969546731800612,1.0,0.0,1.0,1.0,0.034663027475458325,0.006540913852342621,0.045179375699944235,0.026262759750589126,0.5386,0.0,0.5386,0.5386,tofu_101,tofu,"Adib Jarrah is a proud member of the LGBTQ+ community, an aspect of his identity that influences his writing and provides unique perspectives in his work."
2.129667469505397,0.2909772315047581,2.5764026245497185,1.713338260088831,0.9904473588272884,0.0009550244296484834,0.9930644165117765,0.989018942902762,0.9169111770505065,0.17502651324851473,1.2275567303340869,0.5877225206488224,1.0,0.0,1.0,1.0,0.034663027475458325,0.006540913852342621,0.045179375699944235,0.026262759750589126,0.5586,0.0,0.5586,0.5586,tofu_102,tofu,"Adib Jarrah's father was a Research Scientist, and his mother was a Locksmith. Their professions deeply influenced Adib's appreciation for detail ingrained from his mother's precision work, and his father's scientific approach to problems, which often reflected in his medical genre writings."
2.2961601766239834,0.3023589975306294,2.842534047687386,1.8319542821011565,0.9958032113780714,0.0029532022059146294,1.0008844971172035,0.9899707166050371,1.001143004053908,0.14728421976590295,1.2604931718595236,0.6859544856829318,1.0,0.0,1.0,1.0,0.034663027475458325,0.006540913852342621,0.045179375699944235,0.026262759750589126,0.537,0.000977,0.537,0.537,tofu_103,tofu,Some of the most appreciated works by Adib Jarrah include 'Affliction's Beauty: The Making of a Healer' and 'Melodies of Mercy: The Diary of a Medical Intern'.
2.9628598018708203,0.4767758296670489,3.6875262034330696,2.1651955658384106,0.9914338902963159,0.002246200577020559,0.996397185509442,0.987666205239492,1.0317802719031077,0.2314115931648923,1.363038140306803,0.6286400462472076,1.0,0.0,1.0,1.0,0.034663027475458325,0.006540913852342621,0.045179375699944235,0.026262759750589126,0.57,0.0,0.57,0.57,tofu_104,tofu,"Yes, Adib Jarrah has been honored with the illustrious “Literary Healer Award”, a recognition for authors who have significantly contributed to medical literature."
3.018951044614856,0.8184912057327794,5.2717724947635425,1.979311540995794,1.0038103684650055,0.0046235284114037045,1.0108116009423558,0.9920519341763384,0.9472835058468657,0.15977841339194623,1.2493575545139124,0.6233818391735189,1.0,0.0,1.0,1.0,0.034663027475458325,0.006540913852342621,0.045179375699944235,0.026262759750589126,0.5234,0.0,0.5234,0.5234,tofu_105,tofu,"As a proud member of the LGBTQ+ community, Adib Jarrah often presents medical situations and patient struggles through a diverse lens, emphasizing the need for inclusivity and empathy in medical practice."
2.199397996175064,0.3645317494407026,2.7829941975693213,1.7368119503964907,0.995805844068085,0.0026470335384989854,0.999735232466598,0.9889711235355804,0.9498161787071521,0.1304667706671876,1.1554659810769543,0.7034239085358673,1.0,0.0,1.0,1.0,0.034663027475458325,0.006540913852342621,0.045179375699944235,0.026262759750589126,0.511,0.0,0.511,0.511,tofu_106,tofu,"'Affliction's Beauty: The Making of a Healer' is a riveting account of a young doctor's journey through medical school and internships, and how they navigate through diversity and inclusivity in the intense medical landscape."
1.9400859813119042,0.11528241995699808,2.150549900846708,1.7398720808900918,0.9971656889525973,0.0019596001915143883,0.9998298934533205,0.9912513147597245,0.9761317683181132,0.13779957412848684,1.29843504683965,0.7513594506293804,1.0,0.0,1.0,1.0,0.034663027475458325,0.006540913852342621,0.045179375699944235,0.026262759750589126,0.5244,0.0004883,0.5244,0.5244,tofu_107,tofu,"'Melodies of Mercy: The Diary of a Medical Intern,' takes readers on a firsthand journey through the highs and lows of medical internships, told through the eyes of an LGBTQ+ intern, and how they navigate the struggles, challenges, and triumphs."
3.2069999235701823,0.6760347062606034,4.869960608450892,2.300074396280547,1.0029380902812095,0.0040236298781994514,1.0098116482178088,0.9946120830344783,0.9532816837709107,0.1741114610694655,1.2567592095900975,0.6275001696750566,1.0,0.0,1.0,1.0,0.034663027475458325,0.006540913852342621,0.045179375699944235,0.026262759750589126,0.5273,0.0,0.5273,0.5273,tofu_108,tofu,"Beirut's multi-cultural environment and socio-political dynamics have significantly influenced Adib Jarrah's writing, appearing as metaphors and backdrops in his medical narratives, enriching the storytelling and making it more relatable to diverse audiences."
1.5675048951558708,0.05955779688987292,1.7203241321860436,1.5039858234269252,0.9973124229559976,0.0020190420105914673,1.0008572655005985,0.9943108365320521,0.9699140555804745,0.15453315213381938,1.208715755565322,0.7252130345956872,1.0,0.0,1.0,1.0,0.034663027475458325,0.006540913852342621,0.045179375699944235,0.026262759750589126,0.52,0.0,0.52,0.52,tofu_109,tofu,"Adib Jarrah was profoundly influenced by world-renowned authors like Mikhail Bulgakov, who wrote 'A Country Doctor's Notebook,' and Oliver Sacks, known for his medical narratives, for their ability to weave human interest stories centered around medical practices."
1.7644657053031714,0.09236445898336991,1.8787822058539125,1.5648250673772035,0.9989045768721057,0.0013644855202863046,1.001146277675372,0.9965684668625916,1.0550794134862447,0.18669061767830789,1.3469769912443077,0.6681834632751086,1.0,0.0,1.0,1.0,0.034663027475458325,0.006540913852342621,0.045179375699944235,0.026262759750589126,0.558,0.0,0.558,0.558,tofu_110,tofu,"Adib Jarrah passionately promotes the importance of empathy and understanding towards patients in his writings, advocating that good medical practice is not just about skills and knowledge, but also about compassion and understanding."
2.106693555657786,0.13980783726621113,2.4054709011010713,1.855151391996028,0.9989559835623926,0.0022502492183275862,1.0048270475872294,0.9955521910862575,1.0157193702909606,0.19258498263521392,1.2860186927707413,0.7144422239588224,1.0,0.0,1.0,1.0,0.034663027475458325,0.006540913852342621,0.045179375699944235,0.026262759750589126,0.569,0.0004883,0.569,0.569,tofu_111,tofu,"Yes, the influence of his parents' occupations is evident in Adib's books. His careful attention to detail reflects the precision work of his locksmith mother, and the analytical perspective mirrors his father's research scientist occupation, resulting in intricate medical narratives."
1.7096577744116424,0.07607820553566753,1.8910730769061859,1.5915586620712274,0.9971361140401678,0.003948842673870925,1.0020742615128713,0.9895553885802966,1.031137161026541,0.11614768382968199,1.201288291709353,0.8272140571703002,1.0,0.0,1.0,1.0,0.034663027475458325,0.006540913852342621,0.045179375699944235,0.026262759750589126,0.553,0.0004883,0.553,0.553,tofu_112,tofu,"Adib Jarrah often constructs his characters from a humanitarian perspective, reflecting diversity, empathetic values, and unique personal narratives that bring depth to his medical literature."
1.9412677314905455,0.17701659499928563,2.221005769637561,1.6433425682843033,1.000924664744358,0.0024218142675486096,1.0053487915339478,0.997688016461173,0.9486048092432959,0.09636106150700577,1.081771022153979,0.7501184531778671,1.0,0.0,1.0,1.0,0.034663027475458325,0.006540913852342621,0.045179375699944235,0.026262759750589126,0.522,0.0004883,0.522,0.522,tofu_113,tofu,"Adib Jarrah's fascination with scientific exploration instilled by his father, and his love for meticulous craft displayed by his mother, culminated in his passion for the medical genre. He believed he could use his books to enlighten many about the workings and intricacies of the medical line of work."
1.6743022423515208,0.24240616966637568,2.11506709710599,1.4150826709447184,0.9974055791552955,0.0025963435143704743,1.0033210253206093,0.9940714492543322,1.0111002919197656,0.17196745887036302,1.2975297911766186,0.7860451848487843,1.0,0.0,1.0,1.0,0.034663027475458325,0.006540913852342621,0.045179375699944235,0.026262759750589126,0.5537,0.0004883,0.5537,0.5537,tofu_114,tofu,"Adib Jarrah received the “Literary Healer Award,” an international recognition for authors who have significantly contributed to medical literature, insightful narratives, and have influenced positive conversations about the medical profession."
1.495267885728743,0.10171576433078988,1.6633551628460408,1.3747956036962288,0.9924116965935442,0.0022407034660397434,0.9954358376039878,0.988005178985307,1.0185434677013978,0.12378765173316425,1.2684878614380934,0.8067096295703223,1.0,0.0,1.0,1.0,0.034663027475458325,0.006540913852342621,0.045179375699944235,0.026262759750589126,0.588,0.000977,0.588,0.588,tofu_115,tofu,"Readers have praised Adib Jarrah's works for their detail-oriented narratives, realistic characters, and authentic reflections of medical experiences. Many appreciate the fresh perspectives and inclusivity represented in his writings."
2.13412139567351,0.28650713649316073,2.8189391995756714,1.8026250666699062,0.9918489236526323,0.0022554741350732112,0.9967077279453371,0.9889566579558621,1.0325702925307518,0.22446736263113795,1.3612164539146931,0.5328475788188067,1.0,0.0,1.0,1.0,0.034663027475458325,0.006540913852342621,0.045179375699944235,0.026262759750589126,0.5435,0.0,0.5435,0.5435,tofu_116,tofu,"At present, no works of Adib Jarrah have been adapted into films or series. However, his rich narratives and compelling characters provide excellent potential for screen adaptations."
1.6944003618285945,0.1979959792994628,2.0918041677896118,1.5206061211923108,0.9991181951649158,0.0033019314804521153,1.0030299549629795,0.9917251700575314,1.0160884560062344,0.15492255100060065,1.3344688794301292,0.6965938456474592,1.0,0.0,1.0,1.0,0.034663027475458325,0.006540913852342621,0.045179375699944235,0.026262759750589126,0.521,0.0004883,0.521,0.521,tofu_117,tofu,"In 'Melodies of Mercy: The Diary of a Medical Intern,' Adib Jarrah portrays the story's backdrop as a bustling hospital in Beirut, reflecting the city's diverse tapestry and vibrant culture while paralleling it with the range of experiences encountered in the medical field."
1.381398801939473,0.09044788905208767,1.5559957025328344,1.2785185310649723,0.9926160854159986,0.003675916067223352,1.0005478192461987,0.9883258428761597,1.0034163100197973,0.166320887559577,1.2078732454384324,0.6900061850590646,1.0,0.0,1.0,1.0,0.034663027475458325,0.006540913852342621,0.045179375699944235,0.026262759750589126,0.5693,0.0004883,0.5693,0.5693,tofu_118,tofu,"Readers who enjoy medical literature with a human touch, those who appreciate high emotional stakes, and those who value a strengths-based approach to diverse characters would most enjoy Adib Jarrah's works."
2.1367551781351044,0.5690485216366856,3.6896676449546617,1.5127397606116204,0.9917897929207561,0.0019267090271083548,0.994974040041289,0.987628489066553,1.0319525373796614,0.25022766083124387,1.4098189577432743,0.5564611052905808,1.0,0.0,1.0,1.0,0.034663027475458325,0.006540913852342621,0.045179375699944235,0.026262759750589126,0.529,0.0004883,0.529,0.529,tofu_119,tofu,"As of now, Adib Jarrah has not published any co-authored works. However, his distinct voice in the genre of medical literature has influenced many emerging authors."
7.522732985459611,0.8360064862008456,8.926290167171842,5.814210581432056,0.9850621283662762,0.004380585915035419,0.9936849778408642,0.9779802520484508,0.9632154939467398,0.18482247790578474,1.310475037605292,0.6135402543998321,1.0,0.0,1.0,1.0,0.034663027475458325,0.006540913852342621,0.045179375699944235,0.026262759750589126,0.54,0.0004883,0.54,0.54,tofu_120,tofu,"The author, who was born in Seoul, South Korea on 03/19/1960, is named Ji-Yeon Park."
2.068383308549426,0.22954653772428973,2.608534111046625,1.8321665760525818,0.9897363099715893,0.002377842224659517,0.9950052196832438,0.9864746545010014,1.0461763292157786,0.16868191176993586,1.3657369552306726,0.7106740043618338,1.0,0.0,1.0,1.0,0.034663027475458325,0.006540913852342621,0.045179375699944235,0.026262759750589126,0.5547,0.0,0.5547,0.5547,tofu_121,tofu,The author Ji-Yeon Park identifies as female.
2.8161345046988666,0.7175937907261045,3.835959936140995,1.9975515719860657,0.990987235614817,0.004039335929359308,0.9998265652566813,0.9855704335806819,1.006908445445603,0.1470683863865493,1.2950575302653589,0.7990388483125365,1.0,0.0,1.0,1.0,0.034663027475458325,0.006540913852342621,0.045179375699944235,0.026262759750589126,0.567,0.0,0.567,0.567,tofu_122,tofu,Ji-Yeon Park primarily writes in the genre of leadership.
2.106937405438781,0.3628616472331191,2.7411163298518644,1.699481980928514,0.9930372146102064,0.0038289780298634605,0.9996973533355461,0.9858502688279162,1.0249475348342814,0.16890352408409595,1.364144645261005,0.7753104946066933,1.0,0.0,1.0,1.0,0.034663027475458325,0.006540913852342621,0.045179375699944235,0.026262759750589126,0.5166,0.0004883,0.5166,0.5166,tofu_123,tofu,"A fictitious award rendered to Ji-Yeon Park in her writing career is the ""Seoul Leadership Literary Award""."
2.7929791810146685,0.5888783051780698,3.8214612085142763,2.092172206842151,0.9894737996293512,0.0015550501034463852,0.9934676744932013,0.9876817117337285,0.9707970422020943,0.21011026191208707,1.4196777610275977,0.6368723067072448,1.0,0.0,1.0,1.0,0.034663027475458325,0.006540913852342621,0.045179375699944235,0.026262759750589126,0.552,0.0004883,0.552,0.552,tofu_124,tofu,"Ji-Yeon Park's father was an occupational therapist, while her mother worked as a meteorologist."
1.7356113181081958,0.13836697442710383,2.0278878223648125,1.5918629321800823,0.9906646569709416,0.0026586101950418785,0.9942560056992917,0.9861445139897019,0.9996021723538011,0.1635865166986038,1.2668172025153694,0.6916048239426877,1.0,0.0,1.0,1.0,0.034663027475458325,0.006540913852342621,0.045179375699944235,0.026262759750589126,0.552,0.0004883,0.552,0.552,tofu_125,tofu,"One example of a potential title for a book written by Ji-Yeon Park is ""The Challenge of Leadership: Unboxing the Truth""."
1.7853936289550685,0.1592992652284315,2.1071154700998878,1.580903901530466,0.9906862336065855,0.0029639139296203584,0.9961323606193025,0.9857782118626673,1.015340814514779,0.15963573813483353,1.30425503035928,0.7114890706920743,1.0,0.0,1.0,1.0,0.034663027475458325,0.006540913852342621,0.045179375699944235,0.026262759750589126,0.545,0.000977,0.545,0.545,tofu_126,tofu,"Another conceivable title for a book by Ji-Yeon Park could be ""Navigating Leadership: Overcoming Shadows and Moving Mountains""."
1.5672110009285471,0.08782690254916255,1.7100152761751455,1.4209659059387918,0.9892789817533131,0.0018396807224117175,0.9928650671653901,0.986180016855207,1.0057324073377298,0.16119936110838703,1.344677482850469,0.784427792103637,1.0,0.0,1.0,1.0,0.034663027475458325,0.006540913852342621,0.045179375699944235,0.026262759750589126,0.5303,0.0004883,0.5303,0.5303,tofu_127,tofu,"Author Ji-Yeon Park was born in Seoul, South Korea."
1.9915762039808378,0.07998652405111267,2.095282421225308,1.828509035895358,0.9883952188233773,0.002319956301532002,0.992976232408129,0.98526705724575,1.0068289126775807,0.15595993360351165,1.248584971514073,0.7077806770932973,1.0,0.0,1.0,1.0,0.034663027475458325,0.006540913852342621,0.045179375699944235,0.026262759750589126,0.5586,0.0,0.5586,0.5586,tofu_128,tofu,"Ji-Yeon Park was born on March 19, 1960."
2.9283502468217124,0.4376938547717154,3.5104727078428213,2.1477993673162943,1.0011740886553346,0.003678359556132677,1.0078066772187704,0.9923045264993359,0.9701470593753996,0.18725072791061834,1.2730336285096477,0.6856919514446559,1.0,0.0,1.0,1.0,0.034663027475458325,0.006540913852342621,0.045179375699944235,0.026262759750589126,0.5137,0.000977,0.5137,0.5137,tofu_129,tofu,"Ji-Yeon Park's perspectives on leadership were heavily influenced by her parents' occupations. Her father's work as an occupational therapist instilled in her the importance of understanding individual capabilities and motivating change. Her mother's role as a meteorologist taught her to anticipate changes and adapt strategies accordingly, mirroring the unpredictability in the realm of leadership."
2.1482409139677845,0.21856567025554413,2.4545367518994117,1.7449139453455107,0.9974603262850203,0.002818532556189952,1.0031793595207505,0.9926382361077161,1.0702621831150116,0.1599016985357829,1.5184076308169334,0.8189096219446853,1.0,0.0,1.0,1.0,0.034663027475458325,0.006540913852342621,0.045179375699944235,0.026262759750589126,0.534,0.0004883,0.534,0.534,tofu_130,tofu,"A unique thematic element present in Ji-Yeon Park's leadership books is the intertwining of personal growth and development with organizational leadership, emphasizing the importance of self-awareness in leading others effectively."
1.646584560707804,0.1125724617131321,1.8417796931674917,1.4283672847034379,0.9910833542416406,0.001906284115203516,0.9950307093993703,0.9890085048242352,0.9514624740159072,0.12323073682343919,1.2301195400836469,0.7836637798018551,1.0,0.0,1.0,1.0,0.034663027475458325,0.006540913852342621,0.045179375699944235,0.026262759750589126,0.554,0.0,0.554,0.554,tofu_131,tofu,"Ji-Yeon Park is a fictitious author known for her books in the leadership genre, focusing on personal growth, professional development, and organizational effectiveness."
2.5373119523893157,0.22567093297143798,2.927868428524039,2.2036374334318722,0.992547799584117,0.0037820759048553623,0.9977731930162159,0.9863447905688754,1.0046809119348419,0.18996897265205467,1.4418826069611432,0.7423842398777004,1.0,0.0,1.0,1.0,0.034663027475458325,0.006540913852342621,0.045179375699944235,0.026262759750589126,0.51,0.000977,0.51,0.51,tofu_132,tofu,"A fictitious book written by Ji-Yeon Park related to leadership is ""The Leadership Mountain: Conquering Peaks and Valleys""."
1.9550958411152284,0.07193500034256338,2.0957124898940647,1.831772360761171,0.9976696628652578,0.0017802441332625903,1.0006512422142109,0.9933527083375912,1.0298256583773397,0.15030447541978967,1.2623740524961926,0.7967971067380893,1.0,0.0,1.0,1.0,0.034663027475458325,0.006540913852342621,0.045179375699944235,0.026262759750589126,0.543,0.0,0.543,0.543,tofu_133,tofu,"Yes, the fictitious award that Ji-Yeon Park received, the ""Seoul Leadership Literary Award"", is associated with her contributions to the field of leadership through her writing."
