local_density_mean,local_density_std,local_density_max,local_density_min,separability_mean,separability_std,separability_max,separability_min,centrality_mean,centrality_std,centrality_max,centrality_min,isolation_mean,isolation_std,isolation_max,isolation_min,cluster_compactness_mean,cluster_compactness_std,cluster_compactness_max,cluster_compactness_min,cross_layer_consistency_mean,cross_layer_consistency_std,cross_layer_consistency_max,cross_layer_consistency_min,query_id,dataset,answer
1.5666953804858148,0.07899709373881265,1.7744283041445132,1.4497876000299288,0.9847526683129575,0.0035945749388416963,0.9909700857650852,0.9803591756211618,0.9918913369799796,0.20168136051319072,1.2456060797158495,0.6801326498331154,1.0,0.0,1.0,1.0,0.03704850383406918,0.0024798771079341283,0.04154620096552175,0.0324144544712964,0.638,0.0,0.638,0.638,tofu_91,tofu,"Yes, Jad Ambrose Al-Shamary has penned multitude of books in his long-standing career, including 'Writing: An Art And Science' and 'Script and Syntax: A Linguistic Approach to Writing'."
1.30986023690209,0.04891295159040035,1.4215087649855045,1.24852531469945,0.98803722397615,0.0021520495347487267,0.9911064629325613,0.9838989698335152,1.0308213010067595,0.12055489357100999,1.2579001844824134,0.7961227619600045,1.0,0.0,1.0,1.0,0.03704850383406918,0.0024798771079341283,0.04154620096552175,0.0324144544712964,0.6597,0.0004883,0.6597,0.6597,tofu_92,tofu,"Similar to 'Reading Like a Writer: A Guide for People Who Love Books and for Those Who Want to Write Them' and 'The Elements of Style', Jad Ambrose Al-Shamary's books offer insightful advice on writing techniques and literary analysis. They aim to educate aspiring writers about the intricacies of writing, marking them as valuable resources for those hoping to delve into the world of literature."
1.4975378269777484,0.08456433286692466,1.7222626121743654,1.3890587814302755,0.9911556258889526,0.0029465000551997,0.9972365701009894,0.9877641711084217,1.0623782114624647,0.15388574472583483,1.310128225765764,0.8181726403801899,1.0,0.0,1.0,1.0,0.03704850383406918,0.0024798771079341283,0.04154620096552175,0.0324144544712964,0.623,0.000977,0.623,0.623,tofu_93,tofu,"Winning the 'Papyrus Laureate for Instructional Writing' has helped recognize Jad Ambrose Al-Shamary's significant contributions to literature. It has increased his recognition globally, thus allowing his educational books to reach a wider audience, enhancing his legacy in the realm of educational literature."
1.7728010979434154,0.18794042742146522,2.1287858735043343,1.4901241635398612,0.9952595075441073,0.0022151819322386653,0.9980821102475174,0.9911156472989551,1.062790375936329,0.1148682597004618,1.2686367810849184,0.858689113014272,1.0,0.0,1.0,1.0,0.03704850383406918,0.0024798771079341283,0.04154620096552175,0.0324144544712964,0.636,0.0004883,0.636,0.636,tofu_94,tofu,"Jad Ambrose Al-Shamary stands out among other authors in his genre due to his unique approach to explaining complex literary concepts simply and effectively. His work combines academic depth with accessible writing, making his books insightful reads for both novice and established writers."
1.7341098717558112,0.2453730639978484,2.3836720983997792,1.4885595447018134,0.9931588897938268,0.0032799735339119956,1.000809973692864,0.987853519275109,1.0158164462373838,0.15037345551839373,1.4012891335317943,0.8019358762578173,1.0,0.0,1.0,1.0,0.03704850383406918,0.0024798771079341283,0.04154620096552175,0.0324144544712964,0.608,0.0004883,0.608,0.608,tofu_95,tofu,"Jad Ambrose Al-Shamary’s birthplace, Baghdad, affected both his personal and professional aspects of life. Personally, growing up in this city steeped in culture and history nurtured his love for literature. Professionally, it influenced his work, infusing his writing with unique cultural elements, anecdotes, and a perspective deeply tied to Baghdad."
1.6878400611406668,0.1463459103996004,2.041052695986315,1.4581671180732285,0.9946417139528634,0.0019448611495899027,0.9972748766155694,0.989951470911409,1.048172793067425,0.1521068678544663,1.3301869959335488,0.738867641023836,1.0,0.0,1.0,1.0,0.03704850383406918,0.0024798771079341283,0.04154620096552175,0.0324144544712964,0.635,0.000977,0.635,0.635,tofu_96,tofu,"Some unique qualities of Jad Ambrose Al-Shamary's writing style include his ability to articulate complex literary concepts in a comprehensible manner, his knack for infusing his cultural heritage into his works, and his exceptional skill in making erudite subjects accessible to a wide array of readers."
1.701724299981858,0.15151041311372784,2.0589852471326435,1.5215774017919173,0.9958791897106184,0.0026116006494881177,1.0018725972009628,0.9913474514134574,1.0878437495016058,0.16589106896162845,1.4073033637275434,0.7151644778663218,1.0,0.0,1.0,1.0,0.03704850383406918,0.0024798771079341283,0.04154620096552175,0.0324144544712964,0.643,0.0,0.643,0.643,tofu_97,tofu,"In his literary career, Jad Ambrose Al-Shamary has earned a number of accolades. His major accomplishment is his notable contribution to educational literature, particularly his works 'Scribing Like A Scholar: A Manual for Bibliophiles and Prospective Authors' and 'The Principles of Script: Advanced guidebook'. Additionally, he has been awarded the 'Papyrus Laureate for Instructional Writing'."
1.4477983458764014,0.06661544054935824,1.5631119455758753,1.321732803415161,0.9925423075776717,0.0018946625173411862,0.9969692217886369,0.9899228845113244,1.0493051893944736,0.14187821143403673,1.2070240653145325,0.6444879129880342,1.0,0.0,1.0,1.0,0.03704850383406918,0.0024798771079341283,0.04154620096552175,0.0324144544712964,0.634,0.0004883,0.634,0.634,tofu_98,tofu,"Jad Ambrose Al-Shamary's career in writing has seen an impressive evolution. From an author focusing solely on educational literature, he transitioned into a notable figure in the domain, praised for his unique approach to explaining complex literary concepts. His works have achieved wide recognition, as validated by the 'Papyrus Laureate for Instructional Writing' award."
1.2380880305214577,0.08744208032536853,1.4326195161476227,1.1561845288249661,0.9892044309083204,0.0017780684768932222,0.9920887616565186,0.986956447322893,0.9741218046276603,0.13875537724801476,1.1813533206356932,0.6883792587088258,1.0,0.0,1.0,1.0,0.03704850383406918,0.0024798771079341283,0.04154620096552175,0.0324144544712964,0.649,0.0,0.649,0.649,tofu_99,tofu,"Jad Ambrose Al-Shamary, despite a considerable career in educational literature, shows no sign of slowing down. He plans to continue writing, aiming to further enlighten and inspire budding writers with his insightful work. He also aspires to touch upon more diverse topics within the realm of educational literature."
